<?xml version="1.0" encoding="UTF-8"?>
<!DOCTYPE gimnasio SYSTEM "modelo.dtd">
<gimnasio nombre="FitLife Gym">

  <socios>
    <socio id="S001" estado="activo">
      <nombre>Carlos Martínez</nombre>
      <email>carlos.martinez@email.com</email>
      <telefono>612345678</telefono>
      <fecha_alta>2024-01-15</fecha_alta>
      <tipo_membresia>premium</tipo_membresia>
      <inscripciones>
        <inscripcion ref_clase="C001" fecha="2025-04-01"/>
        <inscripcion ref_clase="C003" fecha="2025-04-05"/>
      </inscripciones>
    </socio>

    <socio id="S002" estado="activo">
      <nombre>Laura Gómez</nombre>
      <email>laura.gomez@email.com</email>
      <telefono>623456789</telefono>
      <fecha_alta>2024-03-10</fecha_alta>
      <tipo_membresia>basica</tipo_membresia>
      <inscripciones>
        <inscripcion ref_clase="C002" fecha="2025-04-02"/>
      </inscripciones>
    </socio>

    <socio id="S003" estado="baja">
      <nombre>Pedro Sánchez</nombre>
      <email>pedro.sanchez@email.com</email>
      <telefono>634567890</telefono>
      <fecha_alta>2023-06-20</fecha_alta>
      <tipo_membresia>basica</tipo_membresia>
      <inscripciones/>
    </socio>

    <socio id="S004" estado="activo">
      <nombre>Ana Torres</nombre>
      <email>ana.torres@email.com</email>
      <telefono>645678901</telefono>
      <fecha_alta>2024-07-01</fecha_alta>
      <tipo_membresia>premium</tipo_membresia>
      <inscripciones>
        <inscripcion ref_clase="C001" fecha="2025-04-01"/>
        <inscripcion ref_clase="C004" fecha="2025-04-10"/>
      </inscripciones>
    </socio>

    <socio id="S005" estado="suspendido">
      <nombre>Javier López</nombre>
      <email>javier.lopez@email.com</email>
      <telefono>656789012</telefono>
      <fecha_alta>2023-11-05</fecha_alta>
      <tipo_membresia>premium</tipo_membresia>
      <inscripciones>
        <inscripcion ref_clase="C002" fecha="2025-03-15"/>
      </inscripciones>
    </socio>
  </socios>

  <entrenadores>
    <entrenador id="E001" especialidad="musculacion">
      <nombre>Marcos Ruiz</nombre>
      <email>marcos.ruiz@fitlifegym.com</email>
      <telefono>667890123</telefono>
      <fecha_contrato>2022-09-01</fecha_contrato>
    </entrenador>

    <entrenador id="E002" especialidad="yoga">
      <nombre>Sofia Herrera</nombre>
      <email>sofia.herrera@fitlifegym.com</email>
      <telefono>678901234</telefono>
      <fecha_contrato>2023-02-14</fecha_contrato>
    </entrenador>

    <entrenador id="E003" especialidad="cardio">
      <nombre>Diego Fernández</nombre>
      <email>diego.fernandez@fitlifegym.com</email>
      <telefono>689012345</telefono>
      <fecha_contrato>2021-05-20</fecha_contrato>
    </entrenador>
  </entrenadores>

  <clases>
    <clase id="C001" tipo="musculacion" estado="activa">
      <nombre>Musculación Avanzada</nombre>
      <descripcion><![CDATA[Clase de musculación de alto rendimiento para socios con experiencia previa. Incluye trabajo con pesas libres y máquinas.]]></descripcion>
      <horario dia="lunes" hora_inicio="09:00" hora_fin="10:00"/>
      <aforo_maximo>15</aforo_maximo>
      <precio_mensual>45.00</precio_mensual>
      <ref_entrenador>E001</ref_entrenador>
    </clase>

    <clase id="C002" tipo="yoga" estado="activa">
      <nombre>Yoga Flow</nombre>
      <descripcion><![CDATA[Sesión de yoga dinámico que combina posturas y respiración para mejorar la flexibilidad y reducir el estrés.]]></descripcion>
      <horario dia="miercoles" hora_inicio="18:00" hora_fin="19:00"/>
      <aforo_maximo>20</aforo_maximo>
      <precio_mensual>35.00</precio_mensual>
      <ref_entrenador>E002</ref_entrenador>
    </clase>

    <clase id="C003" tipo="cardio" estado="activa">
      <nombre>Cardio Intenso</nombre>
      <descripcion><![CDATA[Entrenamiento cardiovascular de alta intensidad. Quema calorías y mejora la resistencia aeróbica.]]></descripcion>
      <horario dia="martes" hora_inicio="07:00" hora_fin="08:00"/>
      <aforo_maximo>25</aforo_maximo>
      <precio_mensual>30.00</precio_mensual>
      <ref_entrenador>E003</ref_entrenador>
    </clase>

    <clase id="C004" tipo="yoga" estado="cancelada">
      <nombre>Yoga Relajación</nombre>
      <descripcion><![CDATA[Sesión suave de yoga centrada en la relajación y la meditación. Apta para todos los niveles.]]></descripcion>
      <horario dia="viernes" hora_inicio="20:00" hora_fin="21:00"/>
      <aforo_maximo>20</aforo_maximo>
      <precio_mensual>35.00</precio_mensual>
      <ref_entrenador>E002</ref_entrenador>
    </clase>
  </clases>

</gimnasio>
